{
  "$schema": "https://json-schema.org/draft/2020-12/schema",
  "$id": "https://local.kaoyan-english/schema/english_pipeline/capture-event-v2.schema.json",
  "title": "English immutable capture event v2",
  "type": "object",
  "additionalProperties": false,
  "required": ["schema_version", "event_id", "event_type", "idempotency_key", "request_sha256", "occurred_at", "producer", "formal_write_count", "formal_writeback"],
  "properties": {
    "schema_version": {"const": "english_capture_event_v2"},
    "event_id": {"type": "string", "pattern": "^EVT-[0-9]{8}-[A-F0-9]{16}$"},
    "event_type": {"enum": ["sentence_captured", "sentence_correction", "article_completed", "english_raw_dialogue_turn_v1"]},
    "idempotency_key": {"type": "string", "minLength": 1},
    "request_sha256": {"$ref": "#/$defs/sha256"},
    "occurred_at": {"type": "string", "format": "date-time"},
    "article": {"type": "object"},
    "source": {"type": "object"},
    "learning": {"type": "object"},
    "candidates": {"type": "array", "items": {"$ref": "#/$defs/candidate"}},
    "observed_signals": {"type": "array", "items": {"$ref": "#/$defs/signal"}},
    "source_signal_ids": {"type": "array", "uniqueItems": true, "items": {"type": "string"}},
    "capture_coverage": {"$ref": "#/$defs/coverage"},
    "supersedes_event_id": {"type": "string"},
    "correction_reason": {"type": "string"},
    "completion": {"type": "object"},
    "parent_raw_capture_id": {"type": "string", "minLength": 1},
    "messages": {"type": "array", "minItems": 2, "items": {"$ref": "#/$defs/message"}},
    "attachments": {"type": "array", "items": {"$ref": "#/$defs/attachment"}},
    "context_identity": {"$ref": "#/$defs/context_identity"},
    "resolution_status": {"enum": ["resolved", "unresolved"]},
    "producer": {"type": "object"},
    "formal_write_count": {"const": 0},
    "formal_writeback": {"const": "none"}
  },
  "allOf": [
    {"if": {"properties": {"event_type": {"enum": ["sentence_captured", "sentence_correction"]}}}, "then": {"required": ["article", "source", "learning", "candidates", "observed_signals", "source_signal_ids", "capture_coverage", "parent_raw_capture_id"]}},
    {"if": {"properties": {"event_type": {"const": "article_completed"}}}, "then": {"required": ["article", "completion"]}},
    {"if": {"properties": {"event_type": {"const": "english_raw_dialogue_turn_v1"}}}, "then": {"required": ["messages", "attachments", "context_identity", "resolution_status"]}}
  ],
  "$defs": {
    "sha256": {"type": "string", "pattern": "^[a-f0-9]{64}$"},
    "message": {
      "type": "object",
      "required": ["role", "message_id", "timestamp", "content"],
      "properties": {
        "role": {"enum": ["user", "assistant"]},
        "message_id": {"type": "string", "minLength": 1},
        "timestamp": {"type": "string", "format": "date-time"},
        "content": {"type": "string", "minLength": 1},
        "complete": {"const": true}
      },
      "additionalProperties": false
    },
    "attachment": {
      "type": "object",
      "required": ["attachment_id", "metadata", "sha256", "durable_ref"],
      "properties": {
        "attachment_id": {"type": "string", "minLength": 1},
        "message_id": {"type": "string", "minLength": 1},
        "metadata": {"type": "object"},
        "sha256": {"$ref": "#/$defs/sha256"},
        "durable_ref": {"type": "string", "minLength": 1}
      },
      "additionalProperties": false
    },
    "context_identity": {
      "type": "object",
      "required": ["conversation_id", "thread_id", "workspace_id", "assistant_context_id"],
      "properties": {
        "conversation_id": {"type": "string", "minLength": 1},
        "thread_id": {"type": "string", "minLength": 1},
        "workspace_id": {"type": "string", "minLength": 1},
        "assistant_context_id": {"type": "string", "minLength": 1}
      },
      "additionalProperties": false
    },
    "candidate": {
      "type": "object", "additionalProperties": false,
      "required": ["item", "candidate_type", "meaning", "decision", "source_signal_ids"],
      "properties": {
        "item": {"type": "string", "minLength": 1}, "candidate_type": {"type": "string"}, "meaning": {"type": "string"},
        "usage": {"type": "string"}, "review_note": {"type": "string"}, "reason": {"type": "string"}, "tier_hint": {"type": "string"},
        "decision": {"enum": ["long_term_candidate", "bbdc_candidate", "article_only", "not_recommended"]},
        "source_signal_ids": {"type": "array", "minItems": 1, "uniqueItems": true, "items": {"type": "string"}}
      }
    },
    "signal": {
      "type": "object", "additionalProperties": false,
      "required": ["signal_id", "signal_type", "canonical_term", "surface_form", "knowledge_state", "provenance", "evidence_refs"],
      "properties": {
        "signal_id": {"type": "string"}, "signal_type": {"enum": ["vocabulary", "phrase", "structure"]},
        "canonical_term": {"type": "string", "minLength": 1}, "surface_form": {"type": "string", "minLength": 1},
        "knowledge_state": {"enum": ["unknown", "mistranslated", "structure_unresolved"]},
        "provenance": {"type": "string"}, "evidence_refs": {"type": "array", "minItems": 1, "items": {"type": "string"}}
      }
    },
    "coverage": {
      "type": "object", "additionalProperties": false,
      "required": ["schema_version", "declared_signal_count", "covered_signal_count", "signals"],
      "properties": {
        "schema_version": {"const": "english_capture_coverage_v2"}, "declared_signal_count": {"type": "integer", "minimum": 0},
        "covered_signal_count": {"type": "integer", "minimum": 0},
        "signals": {"type": "array", "items": {"type": "object", "additionalProperties": false, "required": ["signal_id", "terminal_status"], "properties": {"signal_id": {"type": "string"}, "terminal_status": {"enum": ["candidate", "unmatched"]}}}}
      }
    }
  }
}
